{
  "$schema": "workflow-pack.schema.json",
  "name": "Decision Log",
  "slug": "decision-log",
  "category": "workflow",
  "defaultMode": "draft-only",
  "workflow": "workflows/decision-log.md",
  "prompt": "prompts/decision-log.md",
  "schema": "schemas/decision-log.schema.json",
  "example": "examples/decision-log-sample.md",
  "requiredConnectors": [],
  "optionalConnectors": ["documents", "tickets", "local notes", "local memory"],
  "writeRequiresApproval": true,
  "memoryWritesRequireApproval": true,
  "outputs": ["decision statement", "context", "options", "rationale", "follow-up actions", "memory proposal"]
}
